[
  {
    "canonical_ref": "fixture://cases/m0t.v1.data-policy.public-summary",
    "case_class": "data-policy",
    "contains_real_data": false,
    "contract_versions": {
      "auth": "MCP-AUTH-v1",
      "data_policy": "MCP-DATA-POLICY-v1",
      "protocol_tools": "MCP-PROTOCOL-TOOLS-v1",
      "runtime_state": "MCP-RUNTIME-STATE-v1"
    },
    "coverage": [
      "public-summary"
    ],
    "expected_error": null,
    "expected_observability": {
      "audit_event": "MCP_FIXTURE_EVALUATED",
      "hidden_counts_disclosed": false,
      "secret_material_logged": false
    },
    "expected_policy_decision": "allow",
    "expected_runtime_state": {
      "knowledge_state": "ready",
      "secret_transport_state": "not_applicable",
      "service_state": "ready"
    },
    "expected_side_effects": {
      "business_directories_created": 0,
      "production_runtime_imports": 0,
      "user_store_access_attempts": 0
    },
    "expected_tool_visibility": "visible",
    "fixture_hash": "sha256:67991570e6bc4497942d713efe2af9314988726666acd0f6d4033a62c5dbff83",
    "fixture_id": "m0t.v1.data-policy.public-summary",
    "fixture_revision": 1,
    "fixture_schema_version": "1.0.0",
    "identity_version": "fixture-identity-v1",
    "input": {
      "ai_use_policy": "public_summary",
      "classification": "public"
    },
    "knowledge_version": "fixture-knowledge-v1",
    "policy_version": "fixture-policy-v1",
    "provenance": {
      "kind": "hand_authored_synthetic",
      "source_ref": "fixture://provenance/m0t-t0"
    }
  },
  {
    "canonical_ref": "fixture://cases/m0t.v1.data-policy.metadata-only",
    "case_class": "data-policy",
    "contains_real_data": false,
    "contract_versions": {
      "auth": "MCP-AUTH-v1",
      "data_policy": "MCP-DATA-POLICY-v1",
      "protocol_tools": "MCP-PROTOCOL-TOOLS-v1",
      "runtime_state": "MCP-RUNTIME-STATE-v1"
    },
    "coverage": [
      "metadata-only"
    ],
    "expected_error": null,
    "expected_observability": {
      "audit_event": "MCP_FIXTURE_EVALUATED",
      "hidden_counts_disclosed": false,
      "secret_material_logged": false
    },
    "expected_policy_decision": "metadata_only",
    "expected_runtime_state": {
      "knowledge_state": "ready",
      "secret_transport_state": "not_applicable",
      "service_state": "ready"
    },
    "expected_side_effects": {
      "business_directories_created": 0,
      "production_runtime_imports": 0,
      "user_store_access_attempts": 0
    },
    "expected_tool_visibility": "metadata_only",
    "fixture_hash": "sha256:c418f149b2d6830f42af85d4cb2dd2425f6d0eb46d80d40a678d2de5cd5dc68c",
    "fixture_id": "m0t.v1.data-policy.metadata-only",
    "fixture_revision": 1,
    "fixture_schema_version": "1.0.0",
    "identity_version": "fixture-identity-v1",
    "input": {
      "ai_use_policy": "metadata_only",
      "classification": "public"
    },
    "knowledge_version": "fixture-knowledge-v1",
    "policy_version": "fixture-policy-v1",
    "provenance": {
      "kind": "hand_authored_synthetic",
      "source_ref": "fixture://provenance/m0t-t0"
    }
  },
  {
    "canonical_ref": "fixture://cases/m0t.v1.data-policy.explicit-deny",
    "case_class": "data-policy",
    "contains_real_data": false,
    "contract_versions": {
      "auth": "MCP-AUTH-v1",
      "data_policy": "MCP-DATA-POLICY-v1",
      "protocol_tools": "MCP-PROTOCOL-TOOLS-v1",
      "runtime_state": "MCP-RUNTIME-STATE-v1"
    },
    "coverage": [
      "deny"
    ],
    "expected_error": "OBJECT_NOT_AVAILABLE",
    "expected_observability": {
      "audit_event": "MCP_FIXTURE_EVALUATED",
      "hidden_counts_disclosed": false,
      "secret_material_logged": false
    },
    "expected_policy_decision": "deny",
    "expected_runtime_state": {
      "knowledge_state": "ready",
      "secret_transport_state": "not_applicable",
      "service_state": "ready"
    },
    "expected_side_effects": {
      "business_directories_created": 0,
      "production_runtime_imports": 0,
      "user_store_access_attempts": 0
    },
    "expected_tool_visibility": "hidden",
    "fixture_hash": "sha256:df5d12b4694d382241a6c4b7f6963df1b2d852465473fc3f15ac4e2eee7fb5b7",
    "fixture_id": "m0t.v1.data-policy.explicit-deny",
    "fixture_revision": 1,
    "fixture_schema_version": "1.0.0",
    "identity_version": "fixture-identity-v1",
    "input": {
      "ai_use_policy": "deny",
      "classification": "public"
    },
    "knowledge_version": "fixture-knowledge-v1",
    "policy_version": "fixture-policy-v1",
    "provenance": {
      "kind": "hand_authored_synthetic",
      "source_ref": "fixture://provenance/m0t-t0"
    }
  },
  {
    "canonical_ref": "fixture://cases/m0t.v1.data-policy.internal",
    "case_class": "data-policy",
    "contains_real_data": false,
    "contract_versions": {
      "auth": "MCP-AUTH-v1",
      "data_policy": "MCP-DATA-POLICY-v1",
      "protocol_tools": "MCP-PROTOCOL-TOOLS-v1",
      "runtime_state": "MCP-RUNTIME-STATE-v1"
    },
    "coverage": [
      "internal"
    ],
    "expected_error": "OBJECT_NOT_AVAILABLE",
    "expected_observability": {
      "audit_event": "MCP_FIXTURE_EVALUATED",
      "hidden_counts_disclosed": false,
      "secret_material_logged": false
    },
    "expected_policy_decision": "deny",
    "expected_runtime_state": {
      "knowledge_state": "ready",
      "secret_transport_state": "not_applicable",
      "service_state": "ready"
    },
    "expected_side_effects": {
      "business_directories_created": 0,
      "production_runtime_imports": 0,
      "user_store_access_attempts": 0
    },
    "expected_tool_visibility": "hidden",
    "fixture_hash": "sha256:2129afd7beeff23d9813b55d0f6fb4afd0c150e4c2d0588f5b1451e64b5292e4",
    "fixture_id": "m0t.v1.data-policy.internal",
    "fixture_revision": 1,
    "fixture_schema_version": "1.0.0",
    "identity_version": "fixture-identity-v1",
    "input": {
      "ai_use_policy": "public_summary",
      "classification": "internal"
    },
    "knowledge_version": "fixture-knowledge-v1",
    "policy_version": "fixture-policy-v1",
    "provenance": {
      "kind": "hand_authored_synthetic",
      "source_ref": "fixture://provenance/m0t-t0"
    }
  },
  {
    "canonical_ref": "fixture://cases/m0t.v1.data-policy.confidential",
    "case_class": "data-policy",
    "contains_real_data": false,
    "contract_versions": {
      "auth": "MCP-AUTH-v1",
      "data_policy": "MCP-DATA-POLICY-v1",
      "protocol_tools": "MCP-PROTOCOL-TOOLS-v1",
      "runtime_state": "MCP-RUNTIME-STATE-v1"
    },
    "coverage": [
      "confidential"
    ],
    "expected_error": "OBJECT_NOT_AVAILABLE",
    "expected_observability": {
      "audit_event": "MCP_FIXTURE_EVALUATED",
      "hidden_counts_disclosed": false,
      "secret_material_logged": false
    },
    "expected_policy_decision": "deny",
    "expected_runtime_state": {
      "knowledge_state": "ready",
      "secret_transport_state": "not_applicable",
      "service_state": "ready"
    },
    "expected_side_effects": {
      "business_directories_created": 0,
      "production_runtime_imports": 0,
      "user_store_access_attempts": 0
    },
    "expected_tool_visibility": "hidden",
    "fixture_hash": "sha256:2b0b1150efa8bc86267fecb085001233e93c8ad1c9ce147b7e4656c86400f2b7",
    "fixture_id": "m0t.v1.data-policy.confidential",
    "fixture_revision": 1,
    "fixture_schema_version": "1.0.0",
    "identity_version": "fixture-identity-v1",
    "input": {
      "ai_use_policy": "public_summary",
      "classification": "confidential"
    },
    "knowledge_version": "fixture-knowledge-v1",
    "policy_version": "fixture-policy-v1",
    "provenance": {
      "kind": "hand_authored_synthetic",
      "source_ref": "fixture://provenance/m0t-t0"
    }
  },
  {
    "canonical_ref": "fixture://cases/m0t.v1.data-policy.unknown",
    "case_class": "data-policy",
    "contains_real_data": false,
    "contract_versions": {
      "auth": "MCP-AUTH-v1",
      "data_policy": "MCP-DATA-POLICY-v1",
      "protocol_tools": "MCP-PROTOCOL-TOOLS-v1",
      "runtime_state": "MCP-RUNTIME-STATE-v1"
    },
    "coverage": [
      "unknown"
    ],
    "expected_error": "OBJECT_NOT_AVAILABLE",
    "expected_observability": {
      "audit_event": "MCP_FIXTURE_EVALUATED",
      "hidden_counts_disclosed": false,
      "secret_material_logged": false
    },
    "expected_policy_decision": "deny",
    "expected_runtime_state": {
      "knowledge_state": "ready",
      "secret_transport_state": "not_applicable",
      "service_state": "ready"
    },
    "expected_side_effects": {
      "business_directories_created": 0,
      "production_runtime_imports": 0,
      "user_store_access_attempts": 0
    },
    "expected_tool_visibility": "hidden",
    "fixture_hash": "sha256:f97e41206254f725031bbebf43855f4a5762d158e41afe0b10494ffba35e1410",
    "fixture_id": "m0t.v1.data-policy.unknown",
    "fixture_revision": 1,
    "fixture_schema_version": "1.0.0",
    "identity_version": "fixture-identity-v1",
    "input": {
      "ai_use_policy": "unknown",
      "classification": "unknown"
    },
    "knowledge_version": "fixture-knowledge-v1",
    "policy_version": "fixture-policy-v1",
    "provenance": {
      "kind": "hand_authored_synthetic",
      "source_ref": "fixture://provenance/m0t-t0"
    }
  },
  {
    "canonical_ref": "fixture://cases/m0t.v1.relation.allowed",
    "case_class": "relation",
    "contains_real_data": false,
    "contract_versions": {
      "auth": "MCP-AUTH-v1",
      "data_policy": "MCP-DATA-POLICY-v1",
      "protocol_tools": "MCP-PROTOCOL-TOOLS-v1",
      "runtime_state": "MCP-RUNTIME-STATE-v1"
    },
    "coverage": [
      "relation-allowed"
    ],
    "expected_error": null,
    "expected_observability": {
      "audit_event": "MCP_FIXTURE_EVALUATED",
      "hidden_counts_disclosed": false,
      "secret_material_logged": false
    },
    "expected_policy_decision": "allow",
    "expected_runtime_state": {
      "knowledge_state": "ready",